,Keyword,Title,Author,Publication_title,Publication_date,Place_of_publication,First_page,Section,Document_URL,State
12150,gas_tax,Janet Mills' plan to grow Maine's economy in the next decade,"Shepherd, Michael","Bangor Daily News; Bangor, Me.","Dec 11, 2019","Bangor, Me.",,,https://www.proquest.com/newspapers/janet-mills-plan-grow-maines-economy-next-decade/docview/2323561389/se-2?accountid=13360,ME
12169,gas_tax,Dems: Pay for jobs plan with millionaire tax hike,"Lightman, David","Morning Sentinel; Waterville, Me.","Oct 6, 2011","Waterville, Me.",A.1,Local News,https://www.proquest.com/newspapers/dems-pay-jobs-plan-with-millionaire-tax-hike/docview/896378215/se-2?accountid=13360,ME
12214,gas_tax,Incumbent faces political newcomer ; Bill Diamond and Lani Kelly disagree over TABOR and agree on keeping out casinos.: [FINAL Edition],JUSTIN ELLIS Staff Writer,"Portland Press Herald; Portland, Me.","Oct 26, 2006","Portland, Me.",,Local & State,https://www.proquest.com/newspapers/incumbent-faces-political-newcomer-bill-diamond/docview/277351142/se-2?accountid=13360,ME
12296,gas_tax,Three vie for chance to represent Windham: Incumbent Mark Bryant faces challenge from two: a Green Independent and a Republican.,"Richardson, John","Portland Press Herald; Portland, Me.","Oct 16, 2008","Portland, Me.",B.3,Local & State,https://www.proquest.com/newspapers/three-vie-chance-represent-windham/docview/277305944/se-2?accountid=13360,ME
12326,gas_tax,Logger wary of truck weight plan,"Karkos, Terry","Sun Journal; Lewiston, Me.","Jan 17, 2008","Lewiston, Me.",,River Valley,https://www.proquest.com/newspapers/logger-wary-truck-weight-plan/docview/378878586/se-2?accountid=13360,ME
12605,gas_tax,Education or fines? Looking for ways to cut down on ATV accidents: [FINAL Edition],Deirdre Fleming Staff Writer,"Portland Press Herald; Portland, Me.","Jun 18, 2006","Portland, Me.",,Outdoors,https://www.proquest.com/newspapers/education-fines-looking-ways-cut-down-on-atv/docview/277312899/se-2?accountid=13360,ME
12637,gas_tax,"Congress has much to do, but so little time: Facing the task of funding highway projects and the government itself, both parties push symbolic bills.","Memoli, Michael A","Portland Press Herald; Portland, Me.","Jul 10, 2014","Portland, Me.",A.1,,https://www.proquest.com/newspapers/congress-has-much-do-so-little-time/docview/1545532550/se-2?accountid=13360,ME
12639,gas_tax,"State 1st in use of stimulus Road, water projects create 750 jobs, so far","Miller, Kevin; OF THE NEWS STAFF","Bangor Daily News; Bangor, Me.","Jun 25, 2009","Bangor, Me.",1,A,https://www.proquest.com/newspapers/state-1st-use-stimulus-road-water-projects-create/docview/414378237/se-2?accountid=13360,ME
12685,gas_tax,How will Washington spend your taxes in 2008?,"Riedl, Brian","Sun Journal; Lewiston, Me.","Apr 15, 2008","Lewiston, Me.",A.6,Columnist,https://www.proquest.com/newspapers/how-will-washington-spend-your-taxes-2008/docview/378882614/se-2?accountid=13360,ME
12827,gas_tax,No defense for surveilling Mainers,,"Portland Press Herald; Portland, Me.","Jun 30, 2020","Portland, Me.",A.1,,https://www.proquest.com/newspapers/no-defense-surveilling-mainers/docview/2418521307/se-2?accountid=13360,ME
12829,gas_tax,Transportation officials on edgwe as bond deadline looms,"McGuire, Peter","Morning Sentinel; Waterville, Me.","Aug 14, 2019","Waterville, Me.",2.B,,https://www.proquest.com/newspapers/transportation-officials-on-edgwe-as-bond/docview/2272618436/se-2?accountid=13360,ME
12831,gas_tax,Transportation officials on edge as bond deadline looms,"McGuire, Peter","Kennebec Journal; Augusta, Me.","Aug 14, 2019","Augusta, Me.",2.B,,https://www.proquest.com/newspapers/transportation-officials-on-edge-as-bond-deadline/docview/2272614175/se-2?accountid=13360,ME
12840,gas_tax,"So, where does Washington spend our tax dollars, anyway?","Riedl, Brian","Sun Journal; Lewiston, Me.","Apr 15, 2007","Lewiston, Me.",,Perspective,https://www.proquest.com/newspapers/so-where-does-washington-spend-our-tax-dollars/docview/378826290/se-2?accountid=13360,ME
12868,gas_tax,"State transportation officials sound alarm over bond delays An. Aug. 30 deadline looms to get language on November's ballot, but there's still no date to reconvene the Legislature.","McGuire, Peter","Portland Press Herald; Portland, Me.","Aug 14, 2019","Portland, Me.",A.1,,https://www.proquest.com/newspapers/state-transportation-officials-sound-alarm-over/docview/2272614196/se-2?accountid=13360,ME
12870,gas_tax,Senators should hold public forums,,"Portland Press Herald; Portland, Me.","May 31, 2019","Portland, Me.",A.1,,https://www.proquest.com/newspapers/senators-should-hold-public-forums/docview/2232325033/se-2?accountid=13360,ME
12981,gas_tax,Report details DIF&W woes: [All Edition],"Fleming, Deirdre; Of the NEWS Staff","Bangor Daily News; Bangor, Me.","Jan 10, 2001","Bangor, Me.",,A,https://www.proquest.com/newspapers/report-details-dif-w-woes/docview/414055515/se-2?accountid=13360,ME
13181,gas_tax,"Wednesday, October 10, 2012: Candidate endorsements and same-sex marriage",,"Bangor Daily News; Bangor, Me.","Oct 9, 2012","Bangor, Me.",,,https://www.proquest.com/newspapers/wednesday-october-10-2012-candidate-endorsements/docview/1095334588/se-2?accountid=13360,ME
13228,gas_tax,"At forums, candidates grim on business climate","Monroe, Scott","Kennebec Journal; Augusta, Me.","Oct 15, 2010","Augusta, Me.",A.1,Local News,https://www.proquest.com/newspapers/at-forums-candidates-grim-on-business-climate/docview/758055939/se-2?accountid=13360,ME
13246,gas_tax,Candidates court business groups,SCOTT MONROE AND SUSAN COVER,"Morning Sentinel; Waterville, Me.","Oct 15, 2010","Waterville, Me.",A.1,Local News,https://www.proquest.com/newspapers/candidates-court-business-groups/docview/758056171/se-2?accountid=13360,ME
13274,gas_tax,Monitoring is key to fishing industry,,"Portland Press Herald; Portland, Me.","Mar 13, 2016","Portland, Me.",D.4,,https://www.proquest.com/newspapers/monitoring-is-key-fishing-industry/docview/1772589657/se-2?accountid=13360,ME
13279,gas_tax,"Stopped in their tracks ; State money for road and bridge repairs has dried up, forcing construction companies to idle workers and equipment. Hope lies in a massive bond package going to voters in June.: [FINAL Edition]",TOM BELL Staff Writer,"Portland Press Herald; Portland, Me.","Apr 8, 2007","Portland, Me.",,Business,https://www.proquest.com/newspapers/stopped-their-tracks-state-money-road-bridge/docview/277398953/se-2?accountid=13360,ME
13344,gas_tax,"Locally, Wall Street stalls funds for Maine's streets: State hits surprising obstacles in trying to sell road bond: high rates, no buyers","Gallagher, Noel K","Portland Press Herald; Portland, Me.","Sep 26, 2008","Portland, Me.",,Front,https://www.proquest.com/newspapers/locally-wall-street-stalls-funds-maines-streets/docview/277332950/se-2?accountid=13360,ME
13450,gas_tax,"On day of State of State address, a look at history",Anonymous,"Morning Sentinel; Waterville, Me.","Jan 24, 2012","Waterville, Me.",B.6,Local News,https://www.proquest.com/newspapers/on-day-state-address-look-at-history/docview/917275684/se-2?accountid=13360,ME
13463,gas_tax,"State of the State: Reflective words, big goals: State of the State","Cover, Susan M","Portland Press Herald; Portland, Me.","Jan 23, 2012","Portland, Me.",,News,https://www.proquest.com/newspapers/state-reflective-words-big-goals/docview/1024281534/se-2?accountid=13360,ME
13490,gas_tax,A look back at State of State,Anonymous,"Kennebec Journal; Augusta, Me.","Jan 24, 2012","Augusta, Me.",B.6,Local News,https://www.proquest.com/newspapers/look-back-at-state/docview/917275539/se-2?accountid=13360,ME
14061,net_metering,"LePage again vetoes solar bill: The governor's rejection of the 'net metering' bill was not unexpected, but critics disparage his tactics.","Miller, Kevin","Portland Press Herald; Portland, Me.","Jul 11, 2017","Portland, Me.",C.3,,https://www.proquest.com/newspapers/lepage-again-vetoes-solar-bill/docview/1917617537/se-2?accountid=13360,ME
14114,net_metering,Solar boom in Maine masks lack of support,"TURKEL, TUX","Portland Press Herald; Portland, Me.","Jun 28, 2015","Portland, Me.",A.1,,https://www.proquest.com/newspapers/solar-boom-maine-masks-lack-support/docview/1692061854/se-2?accountid=13360,ME
14116,net_metering,Solar boom in Maine masks lack of support: The looming loss or reduction of subsidies and the 'worst' state incentives in New England cast shadows on the energy option.,"TURKEL, TUX","Portland Press Herald; Portland, Me.","Jun 28, 2015","Portland, Me.",A.1,,https://www.proquest.com/newspapers/solar-boom-maine-masks-lack-support/docview/1691458163/se-2?accountid=13360,ME
14117,net_metering,Pols lukewarm on solar power,"TURKEL, TUX","Kennebec Journal; Augusta, Me.","Jun 28, 2015","Augusta, Me.",2.B,,https://www.proquest.com/newspapers/pols-lukewarm-on-solar-power/docview/1691457879/se-2?accountid=13360,ME
14118,net_metering,State lukewarm on solar power,"TURKEL, TUX","Morning Sentinel; Waterville, Me.","Jun 28, 2015","Waterville, Me.",2.B,,https://www.proquest.com/newspapers/state-lukewarm-on-solar-power/docview/1691457883/se-2?accountid=13360,ME
14155,net_metering,Solar advocates rally as Maine PUC contemplates policy changes,"Thistle, Scott; State Politics Editor","Sun Journal; Lewiston, Me.","Dec 9, 2015","Lewiston, Me.",,State,https://www.proquest.com/newspapers/solar-advocates-rally-as-maine-puc-contemplates/docview/1747185729/se-2?accountid=13360,ME
14160,net_metering,"U.S. industry helped kill solar energy bill in Maine: National installers, cautious about creating uncertainty in the market, lobbied to fight the state legislation and donated to its opponents' PACs.","TURKEL, TUX","Portland Press Herald; Portland, Me.","May 15, 2016","Portland, Me.",A.1,,https://www.proquest.com/newspapers/u-s-industry-helped-kill-solar-energy-bill-maine/docview/1788812174/se-2?accountid=13360,ME
14162,net_metering,Big solar helped kill bill in Maine,"TURKEL, TUX","Kennebec Journal; Augusta, Me.","May 15, 2016","Augusta, Me.",1.A,,https://www.proquest.com/newspapers/big-solar-helped-kill-bill-maine/docview/1788809637/se-2?accountid=13360,ME
14163,net_metering,Big solar helped kill bill in Maine,"TURKEL, TUX","Morning Sentinel; Waterville, Me.","May 15, 2016","Waterville, Me.",1.A,,https://www.proquest.com/newspapers/big-solar-helped-kill-bill-maine/docview/1788808228/se-2?accountid=13360,ME
14164,net_metering,Why money is the real power in Maine's solar energy debate,"Fishell, Darren","Bangor Daily News; Bangor, Me.","Jul 28, 2016","Bangor, Me.",,,https://www.proquest.com/newspapers/why-money-is-real-power-maines-solar-energy/docview/1807608765/se-2?accountid=13360,ME
14175,net_metering,Fight for solar incentive on tap,"TURKEL, TUX","Morning Sentinel; Waterville, Me.","Nov 28, 2016","Waterville, Me.",2.B,,https://www.proquest.com/newspapers/fight-solar-incentive-on-tap/docview/1843753708/se-2?accountid=13360,ME
14176,net_metering,"FOR FRIDAY POST Saturday, April 2, 2016: Second Amendment not obsolete, I-395 connector questions unanswered",,"Bangor Daily News; Bangor, Me.","Mar 31, 2016","Bangor, Me.",,,https://www.proquest.com/newspapers/friday-post-saturday-april-2-2016-second/docview/1777512546/se-2?accountid=13360,ME
14178,net_metering,"Despite political shifts, solar decision expected soon: A proposal to limit incentives for solar homeowners is probably stronger after the results of the November election.","TURKEL, TUX","Portland Press Herald; Portland, Me.","Nov 27, 2016","Portland, Me.",C.3,,https://www.proquest.com/newspapers/despite-political-shifts-solar-decision-expected/docview/1843424699/se-2?accountid=13360,ME
14179,net_metering,"Saturday, April 2, 2016: Second Amendment not obsolete, I-395 connector questions unanswered",,"Bangor Daily News; Bangor, Me.","Apr 1, 2016","Bangor, Me.",,,https://www.proquest.com/newspapers/saturday-april-2-2016-second-amendment-not/docview/1777512267/se-2?accountid=13360,ME
14206,net_metering,LePage vetoes solar bill,"Miller, Kevin","Kennebec Journal; Augusta, Me.","Jul 11, 2017","Augusta, Me.",2.B,,https://www.proquest.com/newspapers/lepage-vetoes-solar-bill/docview/1917615552/se-2?accountid=13360,ME
14207,net_metering,LePage vetoes solar bill,"Miller, Kevin","Morning Sentinel; Waterville, Me.","Jul 11, 2017","Waterville, Me.",2.B,,https://www.proquest.com/newspapers/lepage-vetoes-solar-bill/docview/1917616350/se-2?accountid=13360,ME
14241,net_metering,Council mulling landfill electricity,"Edwards, Keith","Kennebec Journal; Augusta, Me.","Jan 13, 2017","Augusta, Me.",1.A,,https://www.proquest.com/newspapers/council-mulling-landfill-electricity/docview/1857985777/se-2?accountid=13360,ME
14242,net_metering,"PV systems handy in power outages, and brownouts: [ALL Edition]","Dulley, James","Bangor Daily News; Bangor, Me.","Aug 17, 1999","Bangor, Me.",,,https://www.proquest.com/newspapers/pv-systems-handy-power-outages-brownouts/docview/413961466/se-2?accountid=13360,ME
14244,net_metering,"Solar's potential overshadowed by fighting: The state could move away from small, rooftop generation of power and pursue more large-scale generation to wean off fossil fuels.","TURKEL, TUX","Portland Press Herald; Portland, Me.","Aug 28, 2016","Portland, Me.",B.2,,https://www.proquest.com/newspapers/solars-potential-overshadowed-fighting/docview/1814433218/se-2?accountid=13360,ME
14249,net_metering,LePage urges Maine utility regulators to resign over solar decision,"Fishell, Darren; Shepherd, Michael","Bangor Daily News; Bangor, Me.","Feb 10, 2017","Bangor, Me.",,,https://www.proquest.com/newspapers/lepage-urges-maine-utility-regulators-resign-over/docview/1867167908/se-2?accountid=13360,ME
14256,net_metering,Secrecy demands rejection of health bill,,"Portland Press Herald; Portland, Me.","Jun 20, 2017","Portland, Me.",A.1,,https://www.proquest.com/newspapers/secrecy-demands-rejection-health-bill/docview/1911102886/se-2?accountid=13360,ME
14261,net_metering,"On solar, wrong policy, process",,"Kennebec Journal; Augusta, Me.","Sep 18, 2016","Augusta, Me.",1.A,,https://www.proquest.com/newspapers/on-solar-wrong-policy-process/docview/1820404115/se-2?accountid=13360,ME
14266,net_metering,LePage slams solar decision,"Miller, Kevin","Kennebec Journal; Augusta, Me.","Feb 11, 2017","Augusta, Me.",1.A,,https://www.proquest.com/newspapers/lepage-slams-solar-decision/docview/1867109385/se-2?accountid=13360,ME
14269,net_metering,"PUC solar proposal wrong policy, process: The Legislature is the right place to balance conflicting interests on complex issues.",,"Portland Press Herald; Portland, Me.","Sep 18, 2016","Portland, Me.",D.4,,https://www.proquest.com/newspapers/puc-solar-proposal-wrong-policy-process/docview/1820405878/se-2?accountid=13360,ME
14272,net_metering,LePage blasts own picks over solar rule: He says his appointees to the panel should resign after a move to preserve credits for solar energy customers.,"Miller, Kevin","Portland Press Herald; Portland, Me.","Feb 11, 2017","Portland, Me.",A.1,,https://www.proquest.com/newspapers/lepage-blasts-own-picks-over-solar-rule/docview/1867115194/se-2?accountid=13360,ME
14276,net_metering,"On solar, wrong policy, process",,"Morning Sentinel; Waterville, Me.","Sep 18, 2016","Waterville, Me.",1.A,,https://www.proquest.com/newspapers/on-solar-wrong-policy-process/docview/1820403998/se-2?accountid=13360,ME
14288,net_metering,LePage slams PUC's solar decision,"Miller, Kevin","Morning Sentinel; Waterville, Me.","Feb 11, 2017","Waterville, Me.",1.A,,https://www.proquest.com/newspapers/lepage-slams-pucs-solar-decision/docview/1867109670/se-2?accountid=13360,ME
14308,net_metering,Council approves Hatch Hill funds,"Edwards, Keith","Kennebec Journal; Augusta, Me.","May 19, 2017","Augusta, Me.",2.B,,https://www.proquest.com/newspapers/council-approves-hatch-hill-funds/docview/1925227872/se-2?accountid=13360,ME
14315,net_metering,Maine regulators approve rolling back solar credits,"Shepherd, Michael","Bangor Daily News; Bangor, Me.","Jan 31, 2017","Bangor, Me.",,,https://www.proquest.com/newspapers/maine-regulators-approve-rolling-back-solar/docview/1863689896/se-2?accountid=13360,ME
14318,net_metering,"Solar rising with tax credits, lower costs: Rebates can cut a project's expense while photovoltaic panels cost half what they did three years ago.","Turkel, Tux","Portland Press Herald; Portland, Me.","Oct 23, 2011","Portland, Me.",,News,https://www.proquest.com/newspapers/solar-rising-with-tax-credits-lower-costs/docview/1024134817/se-2?accountid=13360,ME
14323,net_metering,Maine's solar energy spat continues to smolder,"Cousins, Christopher; Shepherd, Michael","Bangor Daily News; Bangor, Me.","Feb 15, 2017","Bangor, Me.",,,https://www.proquest.com/newspapers/maines-solar-energy-spat-continues-smolder/docview/1868380586/se-2?accountid=13360,ME
14324,net_metering,PUC gets blowback for solar rules,"Miller, Kevin","Morning Sentinel; Waterville, Me.","Mar 2, 2017","Waterville, Me.",2.B,,https://www.proquest.com/newspapers/puc-gets-blowback-solar-rules/docview/1873256527/se-2?accountid=13360,ME
14326,net_metering,Consultants: Landfill plan viable: Augusta's Hatch Hill expected to make enough methane for 15 years of power,"Edwards, Keith","Kennebec Journal; Augusta, Me.","May 12, 2017","Augusta, Me.",1.A,,https://www.proquest.com/newspapers/consultants-landfill-plan-viable/docview/1901473816/se-2?accountid=13360,ME
14332,net_metering,PUC gets blowback for solar rules,"Miller, Kevin","Kennebec Journal; Augusta, Me.","Mar 2, 2017","Augusta, Me.",2.B,,https://www.proquest.com/newspapers/puc-gets-blowback-solar-rules/docview/1873256943/se-2?accountid=13360,ME
14370,net_metering,Group building community solar farm in Bar Harbor,"Trotter, Bill","Bangor Daily News; Bangor, Me.","Aug 1, 2016","Bangor, Me.",,,https://www.proquest.com/newspapers/group-building-community-solar-farm-bar-harbor/docview/1808191794/se-2?accountid=13360,ME
14376,net_metering,"Thursday, April 21, 2016: Mistaken on same-sex marriage, LePage's solar war",,"Bangor Daily News; Bangor, Me.","Apr 20, 2016","Bangor, Me.",,,https://www.proquest.com/newspapers/thursday-april-21-2016-mistaken-on-same-sex/docview/1782992719/se-2?accountid=13360,ME
14404,net_metering,FOR 6AM FRIDAY POST Solar array adds to the sustainable future of a historically progressive family farm in Maine,"Abbate, Lauren","Bangor Daily News; Bangor, Me.","Feb 9, 2017","Bangor, Me.",,,https://www.proquest.com/newspapers/6am-friday-post-solar-array-adds-sustainable/docview/1867531391/se-2?accountid=13360,ME
14405,net_metering,Solar array adds to the sustainable future of a historically progressive family farm in Maine,"Abbate, Lauren","Bangor Daily News; Bangor, Me.","Feb 10, 2017","Bangor, Me.",,,https://www.proquest.com/newspapers/solar-array-adds-sustainable-future-historically/docview/1866990360/se-2?accountid=13360,ME
14420,net_metering,A winning solution for energy,,"Sun Journal; Lewiston, Me.","May 4, 2017","Lewiston, Me.",,Letters To The Editor,https://www.proquest.com/newspapers/winning-solution-energy/docview/1895318115/se-2?accountid=13360,ME
14421,net_metering,Scott Vlaun: Now is the time to unleash solar power in Maine,,"Sun Journal; Lewiston, Me.","May 15, 2019","Lewiston, Me.",,Columns & Analysis,https://www.proquest.com/newspapers/scott-vlaun-now-is-time-unleash-solar-power-maine/docview/2225524564/se-2?accountid=13360,ME
14433,net_metering,Veto stops landmark pro-solar legislation: Advocates hoped concessions would get the governor to accept some form of the bill; now they're hoping for an override.,"TURKEL, TUX","Portland Press Herald; Portland, Me.","Apr 28, 2016","Portland, Me.",B.2,,https://www.proquest.com/newspapers/veto-stops-landmark-pro-solar-legislation/docview/1784664864/se-2?accountid=13360,ME
14444,net_metering,"Cities, towns forming coalition to push renewable energy","Bouchard, Kelley","Portland Press Herald; Portland, Me.","Jan 7, 2019","Portland, Me.",A.1,,https://www.proquest.com/newspapers/cities-towns-forming-coalition-push-renewable/docview/2164073264/se-2?accountid=13360,ME
14445,net_metering,"Coalition takes aim at energy policies: Municipal group to promote solar, energy-saving acts","Bouchard, Kelley","Kennebec Journal; Augusta, Me.","Jan 7, 2019","Augusta, Me.",1.A,,https://www.proquest.com/newspapers/coalition-takes-aim-at-energy-policies/docview/2164075160/se-2?accountid=13360,ME
14446,net_metering,"Coalition takes aim at energy policies: Municipal group to promote solar, energy-saving acts","Bouchard, Kelley","Morning Sentinel; Waterville, Me.","Jan 7, 2019","Waterville, Me.",1.A,,https://www.proquest.com/newspapers/coalition-takes-aim-at-energy-policies/docview/2164075096/se-2?accountid=13360,ME
14447,net_metering,Solar bill met more powerful foe: Doubt,"TURKEL, TUX","Morning Sentinel; Waterville, Me.","Aug 13, 2017","Waterville, Me.",1.A,,https://www.proquest.com/newspapers/solar-bill-met-more-powerful-foe-doubt/docview/1928126834/se-2?accountid=13360,ME
14448,net_metering,Solar bill met more powerful foe: Doubt,"TURKEL, TUX","Kennebec Journal; Augusta, Me.","Aug 13, 2017","Augusta, Me.",1.A,,https://www.proquest.com/newspapers/solar-bill-met-more-powerful-foe-doubt/docview/1928127276/se-2?accountid=13360,ME
14457,net_metering,Community solar farms can work for neighborhoods,,"Kennebec Journal; Augusta, Me.","May 13, 2015","Augusta, Me.",1.A,,https://www.proquest.com/newspapers/community-solar-farms-can-work-neighborhoods/docview/1680360624/se-2?accountid=13360,ME
14458,net_metering,Community solar farms can work for neighborhoods,,"Morning Sentinel; Waterville, Me.","May 13, 2015","Waterville, Me.",1.A,,https://www.proquest.com/newspapers/community-solar-farms-can-work-neighborhoods/docview/1680360548/se-2?accountid=13360,ME
14464,net_metering,"Solar bill met more powerful foe: Doubt: Blindsided by a late question of constitutionality, backers see an effort to preserve incentives undone by seeds of confusion.","TURKEL, TUX","Portland Press Herald; Portland, Me.","Aug 13, 2017","Portland, Me.",A.1,,https://www.proquest.com/newspapers/solar-bill-met-more-powerful-foe-doubt/docview/1928130587/se-2?accountid=13360,ME
14483,net_metering,"FRIDAY WEB: Saturday, March 25, 2017: Trump budget lacks forethought, time change solution, solar a boon for farmers",,"Bangor Daily News; Bangor, Me.","Mar 23, 2017","Bangor, Me.",,,https://www.proquest.com/newspapers/friday-web-saturday-march-25-2017-trump-budget/docview/1880063173/se-2?accountid=13360,ME
14484,net_metering,"Saturday, March 25, 2017: Trump budget lacks forethought, time change solution, solar a boon for farmers",,"Bangor Daily News; Bangor, Me.","Mar 24, 2017","Bangor, Me.",,,https://www.proquest.com/newspapers/saturday-march-25-2017-trump-budget-lacks/docview/1880491563/se-2?accountid=13360,ME
14488,net_metering,State gives big green light in ’19,"Washuk, Bonnie","Morning Sentinel; Waterville, Me.","Jun 30, 2019","Waterville, Me.",1.A,,https://www.proquest.com/newspapers/state-gives-big-green-light-19/docview/2249391097/se-2?accountid=13360,ME
14493,net_metering,Column wrong: Solar customers don't subsidize other ratepayers,,"Portland Press Herald; Portland, Me.","Oct 6, 2016","Portland, Me.",A.1,,https://www.proquest.com/newspapers/column-wrong-solar-customers-dont-subsidize-other/docview/1826081807/se-2?accountid=13360,ME
14503,net_metering,Maine lawmakers give environmental efforts big green light,"Washuk, Bonnie","Sun Journal; Lewiston, Me.","Jun 30, 2019","Lewiston, Me.",,Maine,https://www.proquest.com/newspapers/maine-lawmakers-give-environmental-efforts-big/docview/2249628119/se-2?accountid=13360,ME
14522,net_metering,Environmental groups want to reverse new solar rules: They say the 'extreme' PUC changes will stifle the industry and were improperly adopted.,"Miller, Kevin","Portland Press Herald; Portland, Me.","Mar 2, 2017","Portland, Me.",B.2,,https://www.proquest.com/newspapers/environmental-groups-want-reverse-new-solar-rules/docview/1873260485/se-2?accountid=13360,ME
14526,net_metering,"CMP chief: Lawmakers should back Gov. LePage's veto of solar bill: There's a smarter, fairer way to advance Maine's energy future than what is now before the Legislature.",,"Portland Press Herald; Portland, Me.","Jul 18, 2017","Portland, Me.",A.1,,https://www.proquest.com/newspapers/cmp-chief-lawmakers-should-back-gov-lepages-veto/docview/1919697302/se-2?accountid=13360,ME
14541,net_metering,Lawmakers have third chance to avert higher electricity costs for all Mainers,,"Bangor Daily News; Bangor, Me.","Apr 3, 2018","Bangor, Me.",,,https://www.proquest.com/newspapers/lawmakers-have-third-chance-avert-higher/docview/2020967450/se-2?accountid=13360,ME
14543,net_metering,CMP: Back LePage's solar veto,,"Morning Sentinel; Waterville, Me.","Jul 19, 2017","Waterville, Me.",1.A,,https://www.proquest.com/newspapers/cmp-back-lepages-solar-veto/docview/1919850552/se-2?accountid=13360,ME
14546,net_metering,Landfill’s gas to feed into grid,"Edwards, Keith","Kennebec Journal; Augusta, Me.","Dec 12, 2018","Augusta, Me.",1.A,,https://www.proquest.com/newspapers/landfill-s-gas-feed-into-grid/docview/2188575911/se-2?accountid=13360,ME
14547,net_metering,CMP: Back LePage's solar veto,,"Kennebec Journal; Augusta, Me.","Jul 19, 2017","Augusta, Me.",1.A,,https://www.proquest.com/newspapers/cmp-back-lepages-solar-veto/docview/1919850903/se-2?accountid=13360,ME
14550,net_metering,"Cutler, Michaud talk energy policy despite LePage's last-minute withdrawal from forum","Fishell, Darren","Bangor Daily News; Bangor, Me.","Sep 12, 2014","Bangor, Me.",,,https://www.proquest.com/newspapers/cutler-michaud-talk-energy-policy-despite-lepages/docview/1561683421/se-2?accountid=13360,ME
