,Keyword,Title,Author,Publication_title,Publication_date,Place_of_publication,First_page,Section,Document_URL,State
26,cap_and_trade,Both congressional candidates call environmental issues a top priority: Election 2008: Chellie Pingree and Charlie Summers differ on cap-and-trade agreements.,"Hoey, Dennis","Portland Press Herald; Portland, Me.","Sep 29, 2008","Portland, Me.",A.4,FRONT,https://www.proquest.com/newspapers/both-congressional-candidates-call-environmental/docview/277322118/se-2?accountid=13360,ME
47,cap_and_trade,Coalition to make emissions statement: A 10-state group that formed a cap-and-trade program will hold its first auction Thursday to sell pollution allowances.,"Richardson, John","Portland Press Herald; Portland, Me.","Sep 23, 2008","Portland, Me.",A.1,Front,https://www.proquest.com/newspapers/coalition-make-emissions-statement/docview/277374498/se-2?accountid=13360,ME
53,cap_and_trade,Senators sign on to force vote on mercury ; Maine Sens. Collins and Snowe oppose the EPA's plan for a cap-and- trade system to limit emissions.: [Final Edition],BART JANSEN Washington D.C. Correspondent,"Portland Press Herald; Portland, Me.","Jun 30, 2005","Portland, Me.",,FRONT,https://www.proquest.com/newspapers/senators-sign-on-force-vote-mercury-maine-sens/docview/277253399/se-2?accountid=13360,ME
56,cap_and_trade,Northeast emissions project plots course for national plan: RGGI - or 'Reggie' - is a cap-and-trade effort that began this year and may help to shape U.S. policy.,"Richardson, John","Portland Press Herald; Portland, Me.","Oct 4, 2009","Portland, Me.",A.1,Front,https://www.proquest.com/newspapers/northeast-emissions-project-plots-course-national/docview/277390902/se-2?accountid=13360,ME
136,cap_and_trade,Readers skeptical of proposed 'cap and trade' system,Anonymous,"Bangor Daily News; Bangor, Me.","Jul 3, 2009","Bangor, Me.",11,A,https://www.proquest.com/newspapers/readers-skeptical-proposed-cap-trade-system/docview/414395741/se-2?accountid=13360,ME
155,cap_and_trade,Northeast cap-and-trade pact raises taxes behind 'green' smokescreen,,"Morning Sentinel; Waterville, Me.","Mar 29, 2014","Waterville, Me.",1.A,,https://www.proquest.com/newspapers/northeast-cap-trade-pact-raises-taxes-behind/docview/1534997220/se-2?accountid=13360,ME
158,cap_and_trade,Northeast cap-and-trade pact raises taxes behind 'green' smokescreen,,"Kennebec Journal; Augusta, Me.","Mar 29, 2014","Augusta, Me.",1.A,,https://www.proquest.com/newspapers/northeast-cap-trade-pact-raises-taxes-behind/docview/1534993928/se-2?accountid=13360,ME
185,cap_and_trade,"Green jobs myth muddies debate: Creating a healthier environment costs money, but it's money we'd be wise to spend.",John W Porter ial page,"Portland Press Herald; Portland, Me.","Jun 8, 2008","Portland, Me.",C.6,Editorial,https://www.proquest.com/newspapers/green-jobs-myth-muddies-debate/docview/277383164/se-2?accountid=13360,ME
211,cap_and_trade,Potential still huge for cap-and-trade,"Richardson, John","Morning Sentinel; Waterville, Me.","Oct 4, 2009","Waterville, Me.",A.1,Local News,https://www.proquest.com/newspapers/potential-still-huge-cap-trade/docview/381711056/se-2?accountid=13360,ME
263,cap_and_trade,State among pioneers of cap-and-trade carbon control,"Richardson, John","Kennebec Journal; Augusta, Me.","Oct 4, 2009","Augusta, Me.",A.1,Local News,https://www.proquest.com/newspapers/state-among-pioneers-cap-trade-carbon-control/docview/241775801/se-2?accountid=13360,ME
386,cap_and_trade,"President to give Earth Day speech in Wells ; Protesters will demonstrate against his policies, which they say hurt the environment and our health.: [Final Edition]",MEREDITH GOAD Staff Writer,"Portland Press Herald; Portland, Me.","Apr 22, 2004","Portland, Me.",,FRONT,https://www.proquest.com/newspapers/president-give-earth-day-speech-wells-protesters/docview/277161564/se-2?accountid=13360,ME
440,cap_and_trade,MOVE AHEAD WITH MACT: [All Edition],,"Bangor Daily News; Bangor, Me.","Jul 20, 2004","Bangor, Me.",,A,https://www.proquest.com/newspapers/move-ahead-with-mact/docview/414213424/se-2?accountid=13360,ME
488,cap_and_trade,Environment prospers in legislative session,"Alaimo, Jessica","Sun Journal; Lewiston, Me.","Jun 20, 2007","Lewiston, Me.",,Maine News,https://www.proquest.com/newspapers/environment-prospers-legislative-session/docview/378735295/se-2?accountid=13360,ME
492,cap_and_trade,RISING MERCURY STANDARDS: [All Edition],,"Bangor Daily News; Bangor, Me.","Apr 5, 2004","Bangor, Me.",,A,https://www.proquest.com/newspapers/rising-mercury-standards/docview/414171727/se-2?accountid=13360,ME
684,cap_and_trade,Court strikes down fed emissions policy,"Metzler, Rebekah","Sun Journal; Lewiston, Me.","Feb 9, 2008","Lewiston, Me.",,Maine News,https://www.proquest.com/newspapers/court-strikes-down-fed-emissions-policy/docview/378901279/se-2?accountid=13360,ME
696,cap_and_trade,Maine leaders call for tougher mercury limits ; A new study points to contaminated 'hot spots' in Maine and elsewhere n the Northeast.: [FINAL Edition],JOHN RICHARDSON Staff Writer,"Portland Press Herald; Portland, Me.","Jan 10, 2007","Portland, Me.",,LOCAL & STATE,https://www.proquest.com/newspapers/maine-leaders-call-tougher-mercury-limits-new/docview/277482924/se-2?accountid=13360,ME
757,cap_and_trade,RGGI is Maine's most important step against global warming,"Voorhees, Dylan","Sun Journal; Lewiston, Me.","Apr 1, 2007","Lewiston, Me.",,Columnist,https://www.proquest.com/newspapers/rggi-is-maines-most-important-step-against-global/docview/378739745/se-2?accountid=13360,ME
761,cap_and_trade,"HOW THEY VOTED: MAINE'S CONGRESSIONAL DELEGATION, JUNE 25-JULY 2, 2009 Michaud, Pingree endorse House clean energy package",Anonymous,"Bangor Daily News; Bangor, Me.","Jul 4, 2009","Bangor, Me.",3,A,https://www.proquest.com/newspapers/how-they-voted-maines-congressional-delegation/docview/414425087/se-2?accountid=13360,ME
774,cap_and_trade,Senators approve bill to ban deca: [All Edition],"Miller, Kevin; OF THE NEWS STAFF","Bangor Daily News; Bangor, Me.","Jun 6, 2007","Bangor, Me.",,B,https://www.proquest.com/newspapers/senators-approve-bill-ban-deca/docview/414395064/se-2?accountid=13360,ME
783,cap_and_trade,MERCURY RISING: [All Edition],,"Bangor Daily News; Bangor, Me.","Aug 26, 2004","Bangor, Me.",,A,https://www.proquest.com/newspapers/mercury-rising/docview/414242279/se-2?accountid=13360,ME
823,cap_and_trade,Give coal a respectful goodbye and dry the tears,,"Sun Journal; Lewiston, Me.","Aug 7, 2015","Lewiston, Me.",,Guest Columnists,https://www.proquest.com/newspapers/give-coal-respectful-goodbye-dry-tears/docview/1702176018/se-2?accountid=13360,ME
887,cap_and_trade,Region urged to collaborate on emissions: [All Edition],"Miller, Kevin; OF THE NEWS STAFF","Bangor Daily News; Bangor, Me.","Dec 19, 2006","Bangor, Me.",,A,https://www.proquest.com/newspapers/region-urged-collaborate-on-emissions/docview/414369368/se-2?accountid=13360,ME
897,cap_and_trade,Indiana governor manages to find all the right answers,Anonymous,"Sun Journal; Lewiston, Me.","Jun 16, 2009","Lewiston, Me.",A.7,Columnist,https://www.proquest.com/newspapers/indiana-governor-manages-find-all-right-answers/docview/378966447/se-2?accountid=13360,ME
924,cap_and_trade,"David Sirota: New Republican icon, same old policies",,"Sun Journal; Lewiston, Me.","Nov 19, 2013","Lewiston, Me.",,Guest Columnists,https://www.proquest.com/newspapers/david-sirota-new-republican-icon-same-old/docview/1459482558/se-2?accountid=13360,ME
967,cap_and_trade,Suit contends EPA mercury rules will not protect health ; The Natural Resources Council of Maine joins others pushing for stricter standards for power plant emissions.: [Final Edition],MEREDITH GOAD Staff Writer,"Portland Press Herald; Portland, Me.","Apr 29, 2004","Portland, Me.",,Local & State,https://www.proquest.com/newspapers/suit-contends-epa-mercury-rules-will-not-protect/docview/277178468/se-2?accountid=13360,ME
1007,cap_and_trade,Court rejects Bush rule on mercury emissions,FROM STAFF AND WIRE REPORTS,"Bangor Daily News; Bangor, Me.","Feb 9, 2008","Bangor, Me.",1,A,https://www.proquest.com/newspapers/court-rejects-bush-rule-on-mercury-emissions/docview/414321989/se-2?accountid=13360,ME
1017,cap_and_trade,Mainers protest Senate inaction on climate bill: They urge Sens. Susan Collins and Olympia Snowe to do more to pass comprehensive energy legislation.,REBEKAH METZLERMedia State House Writer,"Portland Press Herald; Portland, Me.","Sep 4, 2010","Portland, Me.",A.1,Front,https://www.proquest.com/newspapers/mainers-protest-senate-inaction-on-climate-bill/docview/749605389/se-2?accountid=13360,ME
1127,cap_and_trade,"Why the rush on climate change? Not because world is warming: In fact, it's not. Instead, advocates are worried people will find out their scare-mongering is false.","Harmon, MD","Portland Press Herald; Portland, Me.","Jul 3, 2009","Portland, Me.",A.13,Editorial,https://www.proquest.com/newspapers/why-rush-on-climate-change-not-because-world-is/docview/277380971/se-2?accountid=13360,ME
1172,cap_and_trade,AFTER COPENHAGEN,Anonymous,"Bangor Daily News; Bangor, Me.","Dec 26, 2009","Bangor, Me.",10,A,https://www.proquest.com/newspapers/after-copenhagen/docview/414387033/se-2?accountid=13360,ME
1254,cap_and_trade,Conservation districts working to develop soil carbon baseline,Anonymous,"Sun Journal; Lewiston, Me.","Jan 28, 2009","Lewiston, Me.",B.4,Connections,https://www.proquest.com/newspapers/conservation-districts-working-develop-soil/docview/378804143/se-2?accountid=13360,ME
1342,cap_and_trade,States poised to set limits on emissions ; Nine northeastern states expect to finalize the nation's first carbon dioxide cap this month.: [Final Edition],JOHN RICHARDSON Staff Writer,"Portland Press Herald; Portland, Me.","Sep 21, 2005","Portland, Me.",,Local & State,https://www.proquest.com/newspapers/states-poised-set-limits-on-emissions-nine/docview/277254860/se-2?accountid=13360,ME
1375,cap_and_trade,CAP AND TRUST: [All Edition],,"Bangor Daily News; Bangor, Me.","Dec 5, 2003","Bangor, Me.",,A,https://www.proquest.com/newspapers/cap-trust/docview/414136721/se-2?accountid=13360,ME
1428,cap_and_trade,Michaud declared winner,"Mistler, Steve","Sun Journal; Lewiston, Me.","Nov 03, 2010","Lewiston, Me.",,Lewiston/Auburn Metro,https://www.proquest.com/newspapers/michaud-declared-winner/docview/762246554/se-2?accountid=13360,ME
1432,cap_and_trade,Michaud holds early lead over Levesque,"Mistler, Steve","Sun Journal; Lewiston, Me.","Nov 03, 2010","Lewiston, Me.",,Lewiston/Auburn Metro,https://www.proquest.com/newspapers/michaud-holds-early-lead-over-levesque/docview/762252251/se-2?accountid=13360,ME
1435,cap_and_trade,Michaud projected to win fifth term in second congresssional district,"Mistler, Steve","Sun Journal; Lewiston, Me.","Nov 03, 2010","Lewiston, Me.",,Lewiston/Auburn Metro,https://www.proquest.com/newspapers/michaud-projected-win-fifth-term-second/docview/762246607/se-2?accountid=13360,ME
1441,cap_and_trade,Brits share advice on greenhouse gas Parliament officials meet with Baldacci: [All Edition],"Miller, Kevin; OF THE NEWS STAFF","Bangor Daily News; Bangor, Me.","Mar 14, 2007","Bangor, Me.",,B,https://www.proquest.com/newspapers/brits-share-advice-on-greenhouse-gas-parliament/docview/414292079/se-2?accountid=13360,ME
1454,cap_and_trade,"Snowe, Collins will wield power in climate debate","Richardson, John","Portland Press Herald; Portland, Me.","Oct 24, 2009","Portland, Me.",A.1,Front,https://www.proquest.com/newspapers/snowe-collins-will-wield-power-climate-debate/docview/277359007/se-2?accountid=13360,ME
1470,cap_and_trade,"Maine senators pivotal in climate debate, too","Richardson, John","Morning Sentinel; Waterville, Me.","Oct 24, 2009","Waterville, Me.",A.1,Local News,https://www.proquest.com/newspapers/maine-senators-pivotal-climate-debate-too/docview/381706660/se-2?accountid=13360,ME
1471,cap_and_trade,Maine's senators key in bill on climate,"Richardson, John","Kennebec Journal; Augusta, Me.","Oct 24, 2009","Augusta, Me.",A.1,Local News,https://www.proquest.com/newspapers/maines-senators-key-bill-on-climate/docview/241757491/se-2?accountid=13360,ME
1525,cap_and_trade,CLIMATE CHANGE PARTNERS: [All Edition],,"Bangor Daily News; Bangor, Me.","Aug 8, 2006","Bangor, Me.",,A,https://www.proquest.com/newspapers/climate-change-partners/docview/414268843/se-2?accountid=13360,ME
1553,cap_and_trade,Maine leaders to decry mercury proposal ; Environmental officials will testify at a hearing on an EPA plan that may allow more emissions.: [Final Edition],JOSHUA L. WEINSTEIN Staff Writer,"Portland Press Herald; Portland, Me.","Feb 25, 2004","Portland, Me.",,Local & State,https://www.proquest.com/newspapers/maine-leaders-decry-mercury-proposal/docview/277156500/se-2?accountid=13360,ME
1593,cap_and_trade,Carbon market to fund state projects,"Miller, Kevin","Bangor Daily News; Bangor, Me.","Jul 9, 2010","Bangor, Me.",,B,https://www.proquest.com/newspapers/carbon-market-fund-state-projects/docview/603598220/se-2?accountid=13360,ME
1615,cap_and_trade,"Federal climate change policies are inevitable ; Increasingly, the debate will be about how to address the threat of global warming.: [STORM Edition]",THEO STEIN EDITORIAL WRITER,"Portland Press Herald; Portland, Me.","Feb 14, 2007","Portland, Me.",,Editorial,https://www.proquest.com/newspapers/federal-climate-change-policies-are-inevitable/docview/277355064/se-2?accountid=13360,ME
1635,cap_and_trade,REGULATING CARBON,Anonymous,"Bangor Daily News; Bangor, Me.","Apr 22, 2009","Bangor, Me.",6,A,https://www.proquest.com/newspapers/regulating-carbon/docview/414360347/se-2?accountid=13360,ME
1660,cap_and_trade,"Maine businesses unite on climate change: Worried by the threat to the state's resources, more than 100 companies will call for federal action.","Richardson, John","Portland Press Herald; Portland, Me.","Feb 4, 2009","Portland, Me.",D.5,Business,https://www.proquest.com/newspapers/maine-businesses-unite-on-climate-change/docview/277332570/se-2?accountid=13360,ME
1661,cap_and_trade,Make a commitment to good environmental choices: [All Edition],"Benoit, Todd","Bangor Daily News; Bangor, Me.","Apr 14, 2007","Bangor, Me.",,A,https://www.proquest.com/newspapers/make-commitment-good-environmental-choices/docview/414391872/se-2?accountid=13360,ME
1735,cap_and_trade,House signs off on gas bill Maine would be included in greenhouse initiative: [All Edition],,"Bangor Daily News; Bangor, Me.","Jun 2, 2007","Bangor, Me.",,B,https://www.proquest.com/newspapers/house-signs-off-on-gas-bill-maine-would-be/docview/414385905/se-2?accountid=13360,ME
1767,cap_and_trade,Maine to sue EPA over mercury emissions ; Maine joins a group of states that want more aggressive limits on coal-fired power plants.: [Final Edition],JOHN RICHARDSON Staff Writer,"Portland Press Herald; Portland, Me.","Mar 29, 2005","Portland, Me.",,Local & State,https://www.proquest.com/newspapers/maine-sue-epa-over-mercury-emissions-joins-group/docview/277222680/se-2?accountid=13360,ME
1826,cap_and_trade,"Energy-efficiency grants could create 1,000 jobs: $8.9 million in funds partly from a carbon emissions trading plan is awarded to 16 projects.","Wilensky-Lanford, Ethan","Portland Press Herald; Portland, Me.","Jan 7, 2010","Portland, Me.",B.1,Local & State,https://www.proquest.com/newspapers/energy-efficiency-grants-could-create-1-000-jobs/docview/277374196/se-2?accountid=13360,ME
1831,cap_and_trade,Carbon-trading initiative yields grants,Anonymous,"Morning Sentinel; Waterville, Me.","Jan 7, 2010","Waterville, Me.",A.1,Local News,https://www.proquest.com/newspapers/carbon-trading-initiative-yields-grants/docview/381717914/se-2?accountid=13360,ME
1849,cap_and_trade,Greenhouse showdown,Anonymous,"Bangor Daily News; Bangor, Me.","Jul 10, 2009","Bangor, Me.",10,A,https://www.proquest.com/newspapers/greenhouse-showdown/docview/414404889/se-2?accountid=13360,ME
1850,cap_and_trade,AUGUSTA Protesters say senators shun involvement in climate cure,"Metzler, Rebekah","Kennebec Journal; Augusta, Me.","Sep 4, 2010","Augusta, Me.",A.1,Local News,https://www.proquest.com/newspapers/augusta-protesters-say-senators-shun-involvement/docview/749438891/se-2?accountid=13360,ME
1851,cap_and_trade,"Up to 1,000 Maine jobs linked to carbon trading",Anonymous,"Kennebec Journal; Augusta, Me.","Jan 7, 2010","Augusta, Me.",A.1,Local News,https://www.proquest.com/newspapers/up-1-000-maine-jobs-linked-carbon-trading/docview/241796731/se-2?accountid=13360,ME
1866,cap_and_trade,Protesters want Senate action on energy,"Metzler, Rebekah","Morning Sentinel; Waterville, Me.","Sep 4, 2010","Waterville, Me.",A.1,Local News,https://www.proquest.com/newspapers/protesters-want-senate-action-on-energy/docview/749439280/se-2?accountid=13360,ME
2049,cap_and_trade,WARMING IN WASHINGTON,Anonymous,"Bangor Daily News; Bangor, Me.","Dec 5, 2007","Bangor, Me.",6,A,https://www.proquest.com/newspapers/warming-washington/docview/414348188/se-2?accountid=13360,ME
2080,cap_and_trade,"Change in the Wind ; As industry officials defend relaxed emission laws, the Mainers who helped develop the Clean Air Act fear the alterations will increase pollution.: [FINAL Edition]",MEREDITH GOAD Staff Writer Staff Writer John Richardson contributed to this article.,"Portland Press Herald; Portland, Me.","Oct 12, 2003","Portland, Me.",,Insight,https://www.proquest.com/newspapers/change-wind-as-industry-officials-defend-relaxed/docview/277146596/se-2?accountid=13360,ME
2229,cap_and_trade,Time for Congress to address global warming,,"Kennebec Journal; Augusta, Me.","Apr 5, 2007","Augusta, Me.",6A,Editorials,https://www.proquest.com/newspapers/time-congress-address-global-warming/docview/241739659/se-2?accountid=13360,ME
2290,cap_and_trade,Time for Congress to address global warming,,"Morning Sentinel; Waterville, Me.","Apr 5, 2007","Waterville, Me.",6A,Editorials,https://www.proquest.com/newspapers/time-congress-address-global-warming/docview/381688157/se-2?accountid=13360,ME
2328,cap_and_trade,ROLL THE CREDITS,"Miller, Kevin","Kennebec Journal; Augusta, Me.","Jul 9, 2010","Augusta, Me.",B.1,Local News,https://www.proquest.com/newspapers/roll-credits/docview/595841120/se-2?accountid=13360,ME
2335,cap_and_trade,CLINTON ADMINISTRATION GIVES DEREGULATION A PUSH ITS PLAN CALLS FOR OPEN COMPETITION NATIONWIDE AMONG ELECTRICITY SUPPLIERS BY 2003.: [CITY Edition],Associated Press,"Portland Press Herald; Portland, Me.","Mar 26, 1998","Portland, Me.",,BUSINESS,https://www.proquest.com/newspapers/clinton-administration-gives-deregulation-push/docview/276857633/se-2?accountid=13360,ME
2357,cap_and_trade,"Maine should leave Regional Greenhouse Gas Initiative compact: A withdrawal would save the state's consumers at least $106 million from 2015 to 2020, a study says.",,"Portland Press Herald; Portland, Me.","Mar 28, 2014","Portland, Me.",A.1,,https://www.proquest.com/newspapers/maine-should-leave-regional-greenhouse-gas/docview/1560660180/se-2?accountid=13360,ME
2452,cap_and_trade,Scontras wages uphill battle against Pingree: But Maine history shows that a GOP challenger can upset a well-funded Democratic incumbent.,"Jordan, Glenn","Portland Press Herald; Portland, Me.","Sep 20, 2010","Portland, Me.",A.1,FRONT,https://www.proquest.com/newspapers/scontras-wages-uphill-battle-against-pingree/docview/751862824/se-2?accountid=13360,ME
2454,cap_and_trade,Questioning the EPA: [All Edition],,"Bangor Daily News; Bangor, Me.","Mar 17, 2005","Bangor, Me.",,A,https://www.proquest.com/newspapers/questioning-epa/docview/414272961/se-2?accountid=13360,ME
2466,cap_and_trade,EPA announces decision to regulate air we breathe,Anonymous,"Sun Journal; Lewiston, Me.","Apr 25, 2009","Lewiston, Me.",A.2,Columnist,https://www.proquest.com/newspapers/epa-announces-decision-regulate-air-we-breathe/docview/378979300/se-2?accountid=13360,ME
2467,cap_and_trade,Race for 1st District seat is on,"Jordan, Glenn","Morning Sentinel; Waterville, Me.","Sep 20, 2010","Waterville, Me.",A.1,Local News,https://www.proquest.com/newspapers/race-1st-district-seat-is-on/docview/751483413/se-2?accountid=13360,ME
2469,cap_and_trade,CONGRESSIONAL DISTRICT 1 Challenger faces 1-term incumbent,"Jordan, Glenn","Kennebec Journal; Augusta, Me.","Sep 20, 2010","Augusta, Me.",A.1,Local News,https://www.proquest.com/newspapers/congressional-district-1-challenger-faces-term/docview/751483389/se-2?accountid=13360,ME
2470,cap_and_trade,"OPPORTUNITY GROWS IN THE MAINE WOODS The Nature Conservancy's vast forestland holdings could benefit from businesses hoping to offset their carbon footprints, opening 'new ways to blend conservation and the timber economy.'","Miller, Kevin","Portland Press Herald; Portland, Me.","Aug 12, 2018","Portland, Me.",A.1,,https://www.proquest.com/newspapers/opportunity-grows-maine-woods-nature-conservancys/docview/2086956569/se-2?accountid=13360,ME
2489,cap_and_trade,Nature Conservancy to fight climate change in Maine woods,"Miller, Kevin","Kennebec Journal; Augusta, Me.","Aug 13, 2018","Augusta, Me.",2.B,,https://www.proquest.com/newspapers/nature-conservancy-fight-climate-change-maine/docview/2087482726/se-2?accountid=13360,ME
2505,cap_and_trade,Letters to the Editor: [CITY Edition 1],,"Portland Press Herald; Portland, Me.","Feb 13, 2000","Portland, Me.",,EDITORIAL,https://www.proquest.com/newspapers/letters-editor/docview/276946245/se-2?accountid=13360,ME
2525,cap_and_trade,"U.S. Senate passes new fishing rules ; The House is expected to OK the bill, which seeks a balance between the resource and the industry.: [Final Edition]",BART JANSEN Washington D.C. Correspondent,"Portland Press Herald; Portland, Me.","Dec 8, 2006","Portland, Me.",,Local & State,https://www.proquest.com/newspapers/u-s-senate-passes-new-fishing-rules-house-is/docview/277357609/se-2?accountid=13360,ME
2527,cap_and_trade,Greenhouse gas bill draws crowd,"Alaimo, Jessica","Sun Journal; Lewiston, Me.","Apr 25, 2007","Lewiston, Me.",,Maine News,https://www.proquest.com/newspapers/greenhouse-gas-bill-draws-crowd/docview/378840828/se-2?accountid=13360,ME
2565,cap_and_trade,BP played the right cards to win political capital,"Lowry, Rich","Sun Journal; Lewiston, Me.","Jun 26, 2010","Lewiston, Me.",,Guest Columns,https://www.proquest.com/newspapers/bp-played-right-cards-win-political-capital/docview/521296862/se-2?accountid=13360,ME
2671,cap_and_trade,Learn from Bush,,"Morning Sentinel; Waterville, Me.","Dec 12, 2018","Waterville, Me.",1.A,,https://www.proquest.com/newspapers/learn-bush/docview/2154521528/se-2?accountid=13360,ME
2691,cap_and_trade,Learn from Bush,,"Kennebec Journal; Augusta, Me.","Dec 12, 2018","Augusta, Me.",1.A,,https://www.proquest.com/newspapers/learn-bush/docview/2154523547/se-2?accountid=13360,ME
2710,cap_and_trade,Collins proposing another approach to climate issue,Anonymous,"Morning Sentinel; Waterville, Me.","Dec 12, 2009","Waterville, Me.",A.1,Local News,https://www.proquest.com/newspapers/collins-proposing-another-approach-climate-issue/docview/381715156/se-2?accountid=13360,ME
2725,cap_and_trade,Collins pressed to back EPA's proposal for stricter power plant emissions limits,"Fishell, Darren","Bangor Daily News; Bangor, Me.","Sep 5, 2014","Bangor, Me.",,,https://www.proquest.com/newspapers/collins-pressed-back-epas-proposal-stricter-power/docview/1560376103/se-2?accountid=13360,ME
2781,cap_and_trade,Clean Power Plan a step toward sunshine for Maine's economy,,"Kennebec Journal; Augusta, Me.","Aug 30, 2015","Augusta, Me.",1.A,,https://www.proquest.com/newspapers/clean-power-plan-step-toward-sunshine-maines/docview/1708041097/se-2?accountid=13360,ME
2809,cap_and_trade,"Wednesday, July 3, 2019: A new America, protect the Arctic refuge, Belfast business and climate change",,"Bangor Daily News; Bangor, Me.","Jul 2, 2019","Bangor, Me.",,,https://www.proquest.com/newspapers/wednesday-july-3-2019-new-america-protect-arctic/docview/2250619420/se-2?accountid=13360,ME
2812,cap_and_trade,'This is a huge success story': 2 Maine scientists say acid rain effects reversing much faster than expected,"Curtis, Abigail","Bangor Daily News; Bangor, Me.","Aug 15, 2014","Bangor, Me.",,,https://www.proquest.com/newspapers/this-is-huge-success-story-2-maine-scientists-say/docview/1553543489/se-2?accountid=13360,ME
2848,cap_and_trade,Mainers press Sen. Collins on emissions: The EPA proposal is the Obama administration's most aggressive plan to regulate power plants.,"Miller, Kevin","Portland Press Herald; Portland, Me.","Sep 6, 2014","Portland, Me.",B.2,,https://www.proquest.com/newspapers/mainers-press-sen-collins-on-emissions/docview/1560326836/se-2?accountid=13360,ME
2876,cap_and_trade,Clean Power Plan a step toward sunshine for Maine's economy,,"Morning Sentinel; Waterville, Me.","Aug 30, 2015","Waterville, Me.",1.A,,https://www.proquest.com/newspapers/clean-power-plan-step-toward-sunshine-maines/docview/1708040944/se-2?accountid=13360,ME
2921,cap_and_trade,EPA's mercury proposal raises ire in Mainers ; Residents warn of the harmful effects of mercury pollution at a hearing held to protest the softening of federal emissions rules.: [Final Edition],MEREDITH GOAD Staff Writer,"Portland Press Herald; Portland, Me.","Mar 2, 2004","Portland, Me.",,Local & State,https://www.proquest.com/newspapers/epas-mercury-proposal-raises-ire-mainers/docview/277236730/se-2?accountid=13360,ME
2935,cap_and_trade,Climate debate on high heat: [FINAL Edition],Bart Jansen Washington D.C. correspondent,"Portland Press Herald; Portland, Me.","Apr 29, 2007","Portland, Me.",,Insight,https://www.proquest.com/newspapers/climate-debate-on-high-heat/docview/277266057/se-2?accountid=13360,ME
3003,cap_and_trade,Collins' support sought on emissions cuts,"Miller, Kevin","Kennebec Journal; Augusta, Me.","Sep 7, 2014","Augusta, Me.",2.B,,https://www.proquest.com/newspapers/collins-support-sought-on-emissions-cuts/docview/1560420401/se-2?accountid=13360,ME
