,Keyword,Title,Author,Publication_title,Publication_date,Place_of_publication,First_page,Section,Document_URL,State
146,cap_and_trade,"LOCAL VOICES: FOR EARTH DAY, SUPPORT CAP-AND-TRADE LAW","Coady, Meg","Daily Press; Newport News, Va.","Apr 19, 2008","Newport News, Va.",C.11,Editorial,https://www.proquest.com/newspapers/local-voices-earth-day-support-cap-trade-law/docview/343549752/se-2?accountid=13360,VA
154,cap_and_trade,"IT'S THE JOBS, STUPID WHAT WAS ON AMERICANS' MINDS: JOBS AND MONEY, NOT HEALTH CARE OR CAP-AND-TRADE.",Anonymous,"Daily Press; Newport News, Va.","Aug 20, 2009","Newport News, Va.",A.17,Editorial,https://www.proquest.com/newspapers/jobs-stupid-what-was-on-americans-minds-money-not/docview/343577363/se-2?accountid=13360,VA
198,cap_and_trade,McCain to pitch environmental policy in Oregon: Speech to outline 'cap-and-trade' plan,"Jackson, David","USA TODAY; McLean, Va.","May 12, 2008","McLean, Va.",,NEWS,https://www.proquest.com/newspapers/mccain-pitch-environmental-policy-oregon/docview/409011010/se-2?accountid=13360,VA
246,cap_and_trade,Imperfect 'cap-and-trade' is best option to fight warming,Anonymous,"USA TODAY; McLean, Va.","Nov 17, 2009","McLean, Va.",,NEWS,https://www.proquest.com/newspapers/imperfect-cap-trade-is-best-option-fight-warming/docview/409088745/se-2?accountid=13360,VA
393,cap_and_trade,Your Opinion,Anonymous,"The Progress - Index; Petersburg, Va.","Sep 3, 2008","Petersburg, Va.",A.4,,https://www.proquest.com/newspapers/your-opinion/docview/366016184/se-2?accountid=13360,VA
437,cap_and_trade,"MCDONNELL, DEEDS SPLIT ON ENVIRONMENT",Scott Harper The Virginian-Pilot,"Daily Press; Newport News, Va.","Sep 21, 2009","Newport News, Va.",A.6,Local,https://www.proquest.com/newspapers/mcdonnell-deeds-split-on-environment/docview/343588993/se-2?accountid=13360,VA
470,cap_and_trade,LETTERS TO THE EDITOR,Anonymous,"Daily Press; Newport News, Va.","Jul 14, 2009","Newport News, Va.",A.13,Editorial,https://www.proquest.com/newspapers/letters-editor/docview/343616918/se-2?accountid=13360,VA
489,cap_and_trade,Support lawmakers who prize environment,Anonymous,"USA TODAY; McLean, Va.","Aug 16, 2011","McLean, Va.",,NEWS,https://www.proquest.com/newspapers/support-lawmakers-who-prize-environment/docview/883525646/se-2?accountid=13360,VA
500,cap_and_trade,LAST CHANCE FOR ENVIRONMENT BILLS?,Cory Nealon cnealon@dailypress.com - 247-4760,"Daily Press; Newport News, Va.","Nov 20, 2010","Newport News, Va.",A.7,Local,https://www.proquest.com/newspapers/last-chance-environment-bills/docview/807539822/se-2?accountid=13360,VA
503,cap_and_trade,SCOUTS LEARN ABOUT SAVING ENVIRONMENT,Tim Chapman RICHMOND TIMES-DISPATCH,"Daily Press; Newport News, Va.","Aug 4, 2010","Newport News, Va.",A.12,Local,https://www.proquest.com/newspapers/scouts-learn-about-saving-environment/docview/734866359/se-2?accountid=13360,VA
504,cap_and_trade,ENVIRONMENT AND THE 2012 ELECTIONS,"Cuker, Benjamin","Daily Press; Newport News, Va.","Sep 23, 2012","Newport News, Va.",A.23,Editorial,https://www.proquest.com/newspapers/environment-2012-elections/docview/1063410201/se-2?accountid=13360,VA
537,cap_and_trade,"Congressional Candidate Talks Jobs, Environment",Anonymous,"The Progress - Index; Petersburg, Va.","Oct 22, 2010","Petersburg, Va.",,News,https://www.proquest.com/newspapers/congressional-candidate-talks-jobs-environment/docview/759648786/se-2?accountid=13360,VA
582,cap_and_trade,"Fixing climate carries big costs ; Report: Environment, economy will benefit: [FINAL Edition]","Vergano, Dan","USA TODAY; McLean, Va.","May 3, 2007","McLean, Va.",,LIFE,https://www.proquest.com/newspapers/fixing-climate-carries-big-costs-report/docview/408972216/se-2?accountid=13360,VA
717,cap_and_trade,'There is a better way',"Bond, Kit","USA TODAY; McLean, Va.","Nov 17, 2009","McLean, Va.",,NEWS,https://www.proquest.com/newspapers/there-is-better-way/docview/409074013/se-2?accountid=13360,VA
729,cap_and_trade,Stop the foot-dragging and build the Keystone pipeline,,"USA TODAY; McLean, Va.","Feb 19, 2013","McLean, Va.",,NEWS,https://www.proquest.com/newspapers/stop-foot-dragging-build-keystone-pipeline/docview/1288864225/se-2?accountid=13360,VA
801,cap_and_trade,BIG-BUSINESS AD CRITICIZES KAINE: Spot favoring GOP's Allen links Democrat to push for new taxes,"Lewis, Bob","Daily Press; Newport News, Va.","Jul 27, 2012","Newport News, Va.",A.4,Local,https://www.proquest.com/newspapers/big-business-ad-criticizes-kaine/docview/1029389329/se-2?accountid=13360,VA
858,cap_and_trade,"All pain, no gain","Inhofe, Jim","USA TODAY; McLean, Va.","May 17, 2011","McLean, Va.",,NEWS,https://www.proquest.com/newspapers/all-pain-no-gain/docview/867096970/se-2?accountid=13360,VA
953,cap_and_trade,Health care deserves public option,Anonymous,"USA TODAY; McLean, Va.","Oct 23, 2009","McLean, Va.",,NEWS,https://www.proquest.com/newspapers/health-care-deserves-public-option/docview/409078274/se-2?accountid=13360,VA
956,cap_and_trade,LETTERS TO THE EDITOR,Anonymous,"Daily Press; Newport News, Va.","Jan 10, 2011","Newport News, Va.",A.13,Editorial,https://www.proquest.com/newspapers/letters-editor/docview/826323703/se-2?accountid=13360,VA
1056,cap_and_trade,CONGRESS PUTS GLOBAL WARMING ON ITS PLATE: [Final Edition],DAVID LERMAN dlerman@tribune.com 202-824-8224,"Daily Press; Newport News, Va.","Oct 25, 2007","Newport News, Va.",,A-Section,https://www.proquest.com/newspapers/congress-puts-global-warming-on-plate/docview/343549670/se-2?accountid=13360,VA
1060,cap_and_trade,Ripe For Energy Independence,Anonymous,"The Progress - Index; Petersburg, Va.","Mar 25, 2011","Petersburg, Va.",,News,https://www.proquest.com/newspapers/ripe-energy-independence/docview/858724021/se-2?accountid=13360,VA
1075,cap_and_trade,POWER BEHIND DEREGULATION ADMINISTRATION IS FOR NATIONWIDE ELECTRICAL-UTILITY COMPETITION: [Final Edition],The Associated Press,"Daily Press; Newport News, Va.","Mar 26, 1998","Newport News, Va.",,Business,https://www.proquest.com/newspapers/power-behind-deregulation-administration-is/docview/342864934/se-2?accountid=13360,VA
1085,cap_and_trade,McCain pulling in political stars: Says his support comes from a wide spectrum,"Jackson, David","USA TODAY; McLean, Va.","Feb 1, 2008","McLean, Va.",,NEWS,https://www.proquest.com/newspapers/mccain-pulling-political-stars/docview/408985542/se-2?accountid=13360,VA
1163,cap_and_trade,Cuts to carbon emissions too costly or overdue?,,"USA TODAY; McLean, Va.","Jun 4, 2014","McLean, Va.",,NEWS,https://www.proquest.com/newspapers/cuts-carbon-emissions-too-costly-overdue/docview/1532142235/se-2?accountid=13360,VA
1325,cap_and_trade,Unusual coalition pushes legislation to cut emissions,"Fritze, John","USA TODAY; McLean, Va.","Apr 27, 2009","McLean, Va.",,NEWS,https://www.proquest.com/newspapers/unusual-coalition-pushes-legislation-cut/docview/409079518/se-2?accountid=13360,VA
1346,cap_and_trade,SENATE COMMITTEE ADVANCES GLOBAL WARMING BILL: [Final Edition],H. JOSEF HEBERT The Associated Press,"Daily Press; Newport News, Va.","Dec 6, 2007","Newport News, Va.",,Business,https://www.proquest.com/newspapers/senate-committee-advances-global-warming-bill/docview/343488368/se-2?accountid=13360,VA
1447,cap_and_trade,WARNER HOPES CLIMATE IS RIGHT FOR ONE LAST TRIUMPH,David Lerman dlerman@tribune.com 202-824-8224,"Daily Press; Newport News, Va.","Jun 3, 2008","Newport News, Va.",A.1,Local,https://www.proquest.com/newspapers/warner-hopes-climate-is-right-one-last-triumph/docview/343510887/se-2?accountid=13360,VA
1686,cap_and_trade,GE chief sees growth opportunities in 2008,"Lieberman, David","USA TODAY; McLean, Va.","Dec 14, 2007","McLean, Va.",,MONEY,https://www.proquest.com/newspapers/ge-chief-sees-growth-opportunities-2008/docview/409054887/se-2?accountid=13360,VA
1877,cap_and_trade,Could chicken manure help curb climate change?: 'Biochar' is seen as cheap solution,"Winter, Brian","USA TODAY; McLean, Va.","Feb 11, 2010","McLean, Va.",,NEWS,https://www.proquest.com/newspapers/could-chicken-manure-help-curb-climate-change/docview/409091487/se-2?accountid=13360,VA
2095,cap_and_trade,CUCCINELLI RAILS AGAINST EPA ON ENERGY,Cory Nealon cnealon@dailypress.com - 247-4760,"Daily Press; Newport News, Va.","Oct 15, 2010","Newport News, Va.",A.3,Local,https://www.proquest.com/newspapers/cuccinelli-rails-against-epa-on-energy/docview/758465389/se-2?accountid=13360,VA
2256,cap_and_trade,EPA studies emissions storage ; Plan could help curb greenhouse gases: [FINAL Edition],"Carmichael, Bobby","USA TODAY; McLean, Va.","Oct 15, 2007","McLean, Va.",,MONEY,https://www.proquest.com/newspapers/epa-studies-emissions-storage-plan-could-help/docview/409003188/se-2?accountid=13360,VA
2346,cap_and_trade,TROUT CONDITIONS IMPROVING,Ted Strong The Daily Progress,"Daily Press; Newport News, Va.","Jan 4, 2011","Newport News, Va.",A.9,Local,https://www.proquest.com/newspapers/trout-conditions-improving/docview/822285524/se-2?accountid=13360,VA
2401,cap_and_trade,"Obama, Romney spar on climate, energy: Rivals once thought alike","Koch, Wendy","USA TODAY; McLean, Va.","Oct 31, 2012","McLean, Va.",,MONEY,https://www.proquest.com/newspapers/obama-romney-spar-on-climate-energy/docview/1125051288/se-2?accountid=13360,VA
2566,cap_and_trade,Should Uncle Sam play venture capitalist? Consider Solyndra,Anonymous,"USA TODAY; McLean, Va.","Sep 14, 2011","McLean, Va.",,NEWS,https://www.proquest.com/newspapers/should-uncle-sam-play-venture-capitalist-consider/docview/889324191/se-2?accountid=13360,VA
2758,cap_and_trade,BATTLE LINES DRAWN ON BAY BILL,Cory Nealon cnealon@dailypress.com - 247-4760,"Daily Press; Newport News, Va.","Jul 20, 2010","Newport News, Va.",A.1,Local,https://www.proquest.com/newspapers/battle-lines-drawn-on-bay-bill/docview/614073273/se-2?accountid=13360,VA
2988,cap_and_trade,"OUT WITH THE COAL, IN WITH THE NEW AT HU","Cuker, Benjamin","Daily Press; Newport News, Va.","May 10, 2009","Newport News, Va.",A.23,Editorial,https://www.proquest.com/newspapers/out-with-coal-new-at-hu/docview/343600410/se-2?accountid=13360,VA
2993,cap_and_trade,"Big business is, simply, vampiric: Wall Street loves the Democrats ... until the political winds shift. Don't believe it? Follow the money.","Goldberg, Jonah","USA TODAY; McLean, Va.","Mar 3, 2010","McLean, Va.",,NEWS,https://www.proquest.com/newspapers/big-business-is-simply-vampiric/docview/409102830/se-2?accountid=13360,VA
3008,cap_and_trade,"Meet RGGI (or Reggie), the new campaign star","Ress, Dave","Daily Press; Newport News, Va.","Sep 14, 2019","Newport News, Va.",A.3,,https://www.proquest.com/newspapers/meet-rggi-reggie-new-campaign-star/docview/2290013387/se-2?accountid=13360,VA
3224,cap_and_trade,Global warming cuts have a price: That's why there will be no treaty out of U.N. Climate Change Conference,"Vergano, Dan","USA TODAY; McLean, Va.","Nov 24, 2009","McLean, Va.",,LIFE,https://www.proquest.com/newspapers/global-warming-cuts-have-price/docview/409071737/se-2?accountid=13360,VA
3226,cap_and_trade,"To win the race, it takes energy: What the candidates think about the top 6 energy issues","Davidson, Paul; Hagenbaugh, Barbara","USA TODAY; McLean, Va.","Sep 10, 2008","McLean, Va.",,MONEY,https://www.proquest.com/newspapers/win-race-takes-energy/docview/409073208/se-2?accountid=13360,VA
3773,cap_and_trade,Slow down on climate change legislation,Anonymous,"The Progress - Index; Petersburg, Va.","Jan 5, 2010","Petersburg, Va.",A.4,,https://www.proquest.com/newspapers/slow-down-on-climate-change-legislation/docview/577272541/se-2?accountid=13360,VA
3816,cap_and_trade,Boycott British Petroleum,Anonymous,"The Progress - Index; Petersburg, Va.","Jun 24, 2010","Petersburg, Va.",A.4,,https://www.proquest.com/newspapers/boycott-british-petroleum/docview/577290434/se-2?accountid=13360,VA
3897,cap_and_trade,Support of offshore drilling comes late,Anonymous,"USA TODAY; McLean, Va.","Apr 8, 2010","McLean, Va.",,NEWS,https://www.proquest.com/newspapers/support-offshore-drilling-comes-late/docview/409120929/se-2?accountid=13360,VA
3923,cap_and_trade,Ending House page program is shortsighted,Anonymous,"USA TODAY; McLean, Va.","Aug 15, 2011","McLean, Va.",,NEWS,https://www.proquest.com/newspapers/ending-house-page-program-is-shortsighted/docview/883379500/se-2?accountid=13360,VA
3935,cap_and_trade,Conference ends in failure,"Inhofe, James","USA TODAY; McLean, Va.","Dec 21, 2009","McLean, Va.",,NEWS,https://www.proquest.com/newspapers/conference-ends-failure/docview/409070812/se-2?accountid=13360,VA
3956,cap_and_trade,GOP's purity police undermine deals to solve nation's problems: OUR VIEW: Candidates face rigid orthoodoxy,Anonymous,"USA TODAY; McLean, Va.","Jun 3, 2011","McLean, Va.",,EDIT,https://www.proquest.com/newspapers/gops-purity-police-undermine-deals-solve-nations/docview/869978536/se-2?accountid=13360,VA
4078,cap_and_trade,Ex-veep's recipe for change: Gore's latest book offers tools to fix 'climate crises',"Vergano, Dan","USA TODAY; McLean, Va.","Nov 6, 2009","McLean, Va.",,NEWS,https://www.proquest.com/newspapers/ex-veeps-recipe-change/docview/409075039/se-2?accountid=13360,VA
4120,cap_and_trade,WARNER BACKS EMISSIONS PLAN: [Final Edition],David Lerman dlerman@tribune.com | 202-824-8224,"Daily Press; Newport News, Va.","Aug 3, 2007","Newport News, Va.",,A-section,https://www.proquest.com/newspapers/warner-backs-emissions-plan/docview/343458825/se-2?accountid=13360,VA
4168,cap_and_trade,"Industry groups, GOP senators target progressive bills Consortium says the legislation would be bad for businesses","Pierceall, Kimberly","Daily Press; Newport News, Va.","Apr 2, 2020","Newport News, Va.",A.3,,https://www.proquest.com/newspapers/industry-groups-gop-senators-target-progressive/docview/2385135754/se-2?accountid=13360,VA
4201,cap_and_trade,OFFICIAL: CLEAN ENERGY IS KEY TO 'PROSPERITY',Cory Nealon cnealon@dailypress.com 247-4760,"Daily Press; Newport News, Va.","Sep 30, 2009","Newport News, Va.",A.4,Local,https://www.proquest.com/newspapers/official-clean-energy-is-key-prosperity/docview/343589202/se-2?accountid=13360,VA
4227,cap_and_trade,Latest climate change report puts deniers on the hot seat,Anonymous,"USA TODAY; McLean, Va.","May 17, 2011","McLean, Va.",,NEWS,https://www.proquest.com/newspapers/latest-climate-change-report-puts-deniers-on-hot/docview/867096916/se-2?accountid=13360,VA
4262,cap_and_trade,DEEDS BASHES MCDONNELL AT DEBATE,Bob Lewis The Associated Press,"Daily Press; Newport News, Va.","Oct 13, 2009","Newport News, Va.",A.8,Local,https://www.proquest.com/newspapers/deeds-bashes-mcdonnell-at-debate/docview/343642916/se-2?accountid=13360,VA
4405,cap_and_trade,Warming debate doesn't own the day,Anonymous,"USA TODAY; McLean, Va.","Apr 25, 2008","McLean, Va.",,NEWS,https://www.proquest.com/newspapers/warming-debate-doesnt-own-day/docview/409039137/se-2?accountid=13360,VA
4441,cap_and_trade,Environmental agenda energized: Eco-friendly gains in elections boost support,"Koch, Wendy","USA TODAY; McLean, Va.","Nov 12, 2012","McLean, Va.",,MONEY,https://www.proquest.com/newspapers/environmental-agenda-energized/docview/1151370855/se-2?accountid=13360,VA
4460,cap_and_trade,Price holds key to ending nation's addiction to oil: Today's debate: Gas tax,Anonymous,"USA TODAY; McLean, Va.","Jul 26, 2010","McLean, Va.",,EDIT,https://www.proquest.com/newspapers/price-holds-key-ending-nations-addiction-oil/docview/717598938/se-2?accountid=13360,VA
4546,cap_and_trade,Northam unveils a green budget The $733 million plan is heavily focused on environmental issues,"Dietrich, Tamara","Daily Press; Newport News, Va.","Dec 12, 2019","Newport News, Va.",A.1,,https://www.proquest.com/newspapers/northam-unveils-green-budget-733-million-plan-is/docview/2324811356/se-2?accountid=13360,VA
4597,cap_and_trade,WHY RECYCLE?: [Final Edition],Kate M. Krebs MCT FORUM,"Daily Press; Newport News, Va.","Nov 25, 2007","Newport News, Va.",,Outlook,https://www.proquest.com/newspapers/why-recycle/docview/343490809/se-2?accountid=13360,VA
4750,cap_and_trade,Democrats will push on climate change: Policies could carry risk for leaders of new House,"King, Ledyard","USA TODAY; McLean, Va.","Nov 27, 2018","McLean, Va.",A.1,NEWS,https://www.proquest.com/newspapers/democrats-will-push-on-climate-change/docview/2137752716/se-2?accountid=13360,VA
4824,cap_and_trade,EPA carbon-cutting plan could see power shift: Coal industry to feel biggest impact; legal challenges likely,"Koch, Wendy","USA TODAY; McLean, Va.","Jun 3, 2014","McLean, Va.",,MONEY,https://www.proquest.com/newspapers/epa-carbon-cutting-plan-could-see-power-shift/docview/1531649905/se-2?accountid=13360,VA
4992,cap_and_trade,"Conservatives, fear not: Election Day is looming. But the Grand Old Party had gone off the rails, anyway -- and that's hardly an indictment of conservatism. In fact, given a chance, liberalism might simply shine a light on the wisdom of another way.","Goldberg, Jonah","USA TODAY; McLean, Va.","Jun 3, 2008","McLean, Va.",,NEWS,https://www.proquest.com/newspapers/conservatives-fear-not/docview/409029177/se-2?accountid=13360,VA
5016,cap_and_trade,A GOOD FIGHT NEEDED: SOMEONE TO LEAD THE BATTLE AGAINST DIRTY POWER PLANTS: [Final Edition],,"Daily Press; Newport News, Va.","Dec 23, 2007","Newport News, Va.",,Outlook,https://www.proquest.com/newspapers/good-fight-needed-someone-lead-battle-against/docview/343554250/se-2?accountid=13360,VA
5158,cap_and_trade,Ask Congress about a cap on carbon emmissions... [Derived headline],Anonymous,"The Progress - Index; Petersburg, Va.","Aug 11, 2007","Petersburg, Va.",A.4,,https://www.proquest.com/newspapers/ask-congress-about-cap-on-carbon-emmissions/docview/365973185/se-2?accountid=13360,VA
5200,cap_and_trade,LETTERS TO THE EDITOR,Anonymous,"Daily Press; Newport News, Va.","Jun 19, 2010","Newport News, Va.",A.19,Editorial,https://www.proquest.com/newspapers/letters-editor/docview/504720428/se-2?accountid=13360,VA
5327,cap_and_trade,Voter Guide: House District 91,,"Daily Press; Newport News, Va.","Oct 27, 2019","Newport News, Va.",A.8,,https://www.proquest.com/newspapers/voter-guide-house-district-91/docview/2308937198/se-2?accountid=13360,VA
5458,cap_and_trade,"Obama leaves behind an unwanted partisan divide: Having praised cooperation, president found it difficult to achieve","Parsons, Christi; Mascaro, Lisa","Daily Press; Newport News, Va.","Jan 16, 2017","Newport News, Va.",U.2,,https://www.proquest.com/newspapers/obama-leaves-behind-unwanted-partisan-divide/docview/1858602762/se-2?accountid=13360,VA
5535,cap_and_trade,The new power players: Obama's win redefines points of influence in D.C.,"Page, Susan","USA TODAY; McLean, Va.","Nov 7, 2008","McLean, Va.",,NEWS,https://www.proquest.com/newspapers/new-power-players/docview/409099116/se-2?accountid=13360,VA
5630,carbon_tax,Colo. city to vote on 'carbon tax' ; Boulder measure seeks to decrease emissions: [FINAL Edition],"Kenworthy, Tom","USA TODAY; McLean, Va.","Nov 1, 2006","McLean, Va.",,NEWS,https://www.proquest.com/newspapers/colo-city-vote-on-carbon-tax-boulder-measure/docview/409035846/se-2?accountid=13360,VA
5880,carbon_tax,"Fixing climate carries big costs ; Report: Environment, economy will benefit: [FINAL Edition]","Vergano, Dan","USA TODAY; McLean, Va.","May 3, 2007","McLean, Va.",,LIFE,https://www.proquest.com/newspapers/fixing-climate-carries-big-costs-report/docview/408972216/se-2?accountid=13360,VA
5913,carbon_tax,"Congressional Candidate Talks Jobs, Environment",Anonymous,"The Progress - Index; Petersburg, Va.","Oct 22, 2010","Petersburg, Va.",,News,https://www.proquest.com/newspapers/congressional-candidate-talks-jobs-environment/docview/759648786/se-2?accountid=13360,VA
6009,carbon_tax,Stop the foot-dragging and build the Keystone pipeline,,"USA TODAY; McLean, Va.","Feb 19, 2013","McLean, Va.",,NEWS,https://www.proquest.com/newspapers/stop-foot-dragging-build-keystone-pipeline/docview/1288864225/se-2?accountid=13360,VA
6134,carbon_tax,EPA CHIEF: [FINAL Edition],"Kanamine, Linda","USA TODAY (pre-1997 Fulltext); McLean, Va.","Jan 12, 1993","McLean, Va.",,NEWS,https://www.proquest.com/newspapers/epa-chief/docview/306579298/se-2?accountid=13360,VA
6387,carbon_tax,WARNER HOPES CLIMATE IS RIGHT FOR ONE LAST TRIUMPH,David Lerman dlerman@tribune.com 202-824-8224,"Daily Press; Newport News, Va.","Jun 3, 2008","Newport News, Va.",A.1,Local,https://www.proquest.com/newspapers/warner-hopes-climate-is-right-one-last-triumph/docview/343510887/se-2?accountid=13360,VA
6538,carbon_tax,Others may follow Calif.'s lead; State eyes 100% of power from clean sources,"Roth, Sammy","Daily Press; Newport News, Va.","Jan 15, 2019","Newport News, Va.",U.2,,https://www.proquest.com/newspapers/others-may-follow-calif-s-lead-state-eyes-100/docview/2167017268/se-2?accountid=13360,VA
6667,carbon_tax,EPA studies emissions storage ; Plan could help curb greenhouse gases: [FINAL Edition],"Carmichael, Bobby","USA TODAY; McLean, Va.","Oct 15, 2007","McLean, Va.",,MONEY,https://www.proquest.com/newspapers/epa-studies-emissions-storage-plan-could-help/docview/409003188/se-2?accountid=13360,VA
6691,carbon_tax,JAPAN'S TRADE SURPLUS: [FINAL Edition],"Henriques, Maria L","USA TODAY (pre-1997 Fulltext); McLean, Va.","Apr 14, 1993","McLean, Va.",,MONEY,https://www.proquest.com/newspapers/japans-trade-surplus/docview/306591159/se-2?accountid=13360,VA
6733,carbon_tax,Should Uncle Sam play venture capitalist? Consider Solyndra,Anonymous,"USA TODAY; McLean, Va.","Sep 14, 2011","McLean, Va.",,NEWS,https://www.proquest.com/newspapers/should-uncle-sam-play-venture-capitalist-consider/docview/889324191/se-2?accountid=13360,VA
6778,carbon_tax,"Opposing view: We need free- market innovation, not taxation","Barrasso, John","USA TODAY; McLean, Va.","Feb 20, 2020","McLean, Va.",A.7,OPINION,https://www.proquest.com/newspapers/opposing-view-we-need-free-market-innovation-not/docview/2358287656/se-2?accountid=13360,VA
6843,carbon_tax,YOUR VOTES IN WASHINGTON,Thomas Voting Reports Inc,"Daily Press; Newport News, Va.","Jul 22, 2018","Newport News, Va.",A.9,,https://www.proquest.com/newspapers/your-votes-washington/docview/2072958830/se-2?accountid=13360,VA
6914,carbon_tax,GE chief sees growth opportunities in 2008,"Lieberman, David","USA TODAY; McLean, Va.","Dec 14, 2007","McLean, Va.",,MONEY,https://www.proquest.com/newspapers/ge-chief-sees-growth-opportunities-2008/docview/409054887/se-2?accountid=13360,VA
7327,carbon_tax,Time to switch to green' power,,"USA TODAY; McLean, Va.","Jul 1, 2013","McLean, Va.",,NEWS,https://www.proquest.com/newspapers/time-switch-green-power/docview/1372768945/se-2?accountid=13360,VA
7444,carbon_tax,Senate Republicans fiddle while the world warms,,"USA TODAY; McLean, Va.","Apr 1, 2015","McLean, Va.",,NEWS,https://www.proquest.com/newspapers/senate-republicans-fiddle-while-world-warms/docview/1668019149/se-2?accountid=13360,VA
7474,carbon_tax,KAINE'S CLIMATE CHANGE PANEL AGGRESSIVELY TARGETS EMISSIONS,Scott Harper The Virginian-Pilot,"Daily Press; Newport News, Va.","Nov 16, 2008","Newport News, Va.",A.10,Local,https://www.proquest.com/newspapers/kaines-climate-change-panel-aggressively-targets/docview/343540449/se-2?accountid=13360,VA
7485,carbon_tax,Global warming? It's a matter of degree: [FINAL Edition],,"USA TODAY (pre-1997 Fulltext); McLean, Va.","Jan 9, 1996","McLean, Va.",,NEWS,https://www.proquest.com/newspapers/global-warming-matter-degree/docview/306738913/se-2?accountid=13360,VA
7617,carbon_tax,Northam unveils a green budget The $733 million plan is heavily focused on environmental issues,"Dietrich, Tamara","Daily Press; Newport News, Va.","Dec 12, 2019","Newport News, Va.",A.1,,https://www.proquest.com/newspapers/northam-unveils-green-budget-733-million-plan-is/docview/2324811356/se-2?accountid=13360,VA
7907,carbon_tax,WARNER LOSES CHANCE TO SEE CROWNING LEGISLATIVE MOMENT,DAVID LERMAN dlerman@tribune.com 202-824-8224,"Daily Press; Newport News, Va.","Jun 8, 2008","Newport News, Va.",A.1,Local,https://www.proquest.com/newspapers/warner-loses-chance-see-crowning-legislative/docview/343511134/se-2?accountid=13360,VA
8076,carbon_tax,USA's economic problems `quite manageable': [FINAL Edition],"Belton, Beth; Memmott, Mark","USA TODAY (pre-1997 Fulltext); McLean, Va.","Jun 11, 1992","McLean, Va.",,MONEY,https://www.proquest.com/newspapers/usas-economic-problems-quite-manageable/docview/306533088/se-2?accountid=13360,VA
8404,demand-side_management,IS CONSERVATION VA. POWER'S CONCERN?: [Final Edition],The Associated Press,"Daily Press; Newport News, Va.","Jul 14, 1992","Newport News, Va.",,State,https://www.proquest.com/newspapers/is-conservation-va-powers-concern/docview/342614486/se-2?accountid=13360,VA
8453,demand-side_management,Savings seen in hour of energy use Time-of-day pricing reduces electricity costs by leveling out demand surges: [FINAL Edition],"Bayles, Fred","USA TODAY; McLean, Va.","Jul 16, 2001","McLean, Va.",,NEWS,https://www.proquest.com/newspapers/savings-seen-hour-energy-use-time-day-pricing/docview/408835150/se-2?accountid=13360,VA
8524,demand-side_management,IS CONSERVATION VA. POWER'S CONCERN?: [Final Edition],The Associated Press,"Daily Press; Newport News, Va.","Jul 14, 1992","Newport News, Va.",,State,https://www.proquest.com/newspapers/is-conservation-va-powers-concern/docview/342614486/se-2?accountid=13360,VA
8573,demand-side_management,Savings seen in hour of energy use Time-of-day pricing reduces electricity costs by leveling out demand surges: [FINAL Edition],"Bayles, Fred","USA TODAY; McLean, Va.","Jul 16, 2001","McLean, Va.",,NEWS,https://www.proquest.com/newspapers/savings-seen-hour-energy-use-time-day-pricing/docview/408835150/se-2?accountid=13360,VA
8737,gas_tax,Unwise and unaffordable: Today's debate: Gas tax,"Drevna, Charles T","USA TODAY; McLean, Va.","Jul 26, 2010","McLean, Va.",,EDIT,https://www.proquest.com/newspapers/unwise-unaffordable/docview/717434994/se-2?accountid=13360,VA
